ARAB;ENG
جامعة أم القرى;Public Universities
الجامعة الإسلامية ;Public Universities
جامعة الأمام محمد بن سعود الإسلامية;Public Universities
جامعة الملك سعود;Public Universities
جامعة الملك عبد العزيز ;Public Universities
جامعة الملك فهد للبترول والمعادن ;Public Universities
جامعة الملك فيصل;Public Universities
جامعة الملك خالد ;Public Universities
جامعة القصيم ;Public Universities
جامعة طيبة ;Public Universities
جامعة الطائف ;Public Universities
جامعة الملك سعود بن عبد العزيز للعلوم الصحية ;Public Universities
جامعة جازان ;Public Universities
جامعة حائل ;Public Universities
جامعة الجوف ;Public Universities
جامعة تبوك ;Public Universities
جامعة الباحة ;Public Universities
جامعة نجران ;Public Universities
جامعة الأميرة نورة بنت عبد الرحمن ;Public Universities
جامعة الحدود الشمالية ;Public Universities
 جامعة شقراء;Public Universities
جامعة سلمان بن عبدالعزيز;Public Universities
جامعة الدمام ;Public Universities
جامعة المجمعة ;Public Universities
الجامعة السعودية الإلكترونية;Public Universities
إجمالي الجامعات الحكومية;Public Universities
جامعة الأمير سلطان;Private Universities and Colleges
الجامعة العربية الأهلية ;Private Universities and Colleges
جامعة الأمير محمد بن فهد ;Private Universities and Colleges
جامعة الفيصل;Private Universities and Colleges
 جامعة اليمامة ;Private Universities and Colleges
جامعة عفت ;Private Universities and Colleges
جامعة دار العلوم الأهلية ;Private Universities and Colleges
جامعة فهد بن سلطان الأهلية ;Private Universities and Colleges
كليات القصيم الأهلية;Private Universities and Colleges
كلية دار الحكمة;Private Universities and Colleges
كلية الأمير سلطان للسياحة والإدارة بأبها;Private Universities and Colleges
كلية الباحة الأهلية للعلوم ;Private Universities and Colleges
جامعة الأعمال والتكنولوجيا الأهلية;Private Universities and Colleges
كلية الدكتور سليمان فقيه للعلوم الطبية;Private Universities and Colleges
كليات الرياض لطب الأسنان والصيدلة ;Private Universities and Colleges
كلية ابن سينا الأهلية للعلوم الطبية ;Private Universities and Colleges
كلية الأمير سلطان للسياحة والإدارة بجدة ;Private Universities and Colleges
كلية البترجي للعلوم الطبية والتكنولوجيا الأهلية ;Private Universities and Colleges
كلية سعد للتمريض والعلوم الصحية الأهلية ;Private Universities and Colleges
كلية الريادة للعلوم الصحية الأهلية ;Private Universities and Colleges
كلية المعرفة للعلوم والتقنية ;Private Universities and Colleges
كليات بريدة الأهلية ;Private Universities and Colleges
كلية محمد المانع الأهلية للعلوم الطبية;Private Universities and Colleges
كلية الفارابي لطب الأسنان والتمريض;Private Universities and Colleges
كليات الغد الدولية للعلوم الصحية ;Private Universities and Colleges
كليات سليمان الراجحي الأهلية;Private Universities and Colleges
كليات الشرق العربي للدراسات العليا;Private Universities and Colleges
كلية العناية الطبية;Private Universities and Colleges
إجمالي الجامعات والكليات الأهلية;Private Universities and Colleges
كلية الجبيل الصناعية;Other Institutions
كيلة الجبيل الجامعية ;Other Institutions
كلية ينبع الصناعية ;Other Institutions
كلية ينبع الجامعية ;Other Institutions
معهد الإدارة العامة ;Other Institutions
كلية الأمير سلطان للعلوم الصحية بالظهران;Other Institutions
معهد الجبيل التقني ;Other Institutions
المؤسسة العامة للتدريب التقني والمهني;Other Institutions
إجمالي مؤسسات التعليم العالي الأخرى;Other Institutions
إجمالي مؤسسات التعليم العالي في المملكة;All Institution Types
جامعة الإمام محمد بن سعود الإسلامية ;Public Universities
جامعة دار الحكمة ;Private Universities and Colleges
كلية ابن رشد للعلوم الإدارية;Private Universities and Colleges
كلية الجبيل الجامعية ;Other Institutions
قطاع ينبع التعليمي;Other Institutions
كلية الأمير سلطان العسكرية للعلوم الصحية بالظهران;Other Institutions
الجامعة العربية المفتوحة;Private Universities and Colleges
معهد الإدراة العامة;Other Institutions
جامعة أم القرى دراسات عليا;Public Universities
الجامعة الإسلامية دراسات عليا;Public Universities
جامعة الملك سعود دراسات عليا;Public Universities
جامعة الملك عبد العزيز دراسات عليا;Public Universities
جامعة الملك فهد للبترول والمعادن دراسات عليا;Public Universities
جامعة الملك فيصل دراسات عليا;Public Universities
جامعة الملك خالد دراسات عليا;Public Universities
جامعة القصيم دراسات عليا;Public Universities
جامعة طيبة دراسات عليا;Public Universities
جامعة الطائف دراسات عليا;Public Universities
جامعة الملك سعود بن عبد العزيز للعلوم الصحية دراسات عليا;Public Universities
جامعة حائل دراسات عليا;Public Universities
جامعة تبوك دراسات عليا;Public Universities
جامعة الباحة دراسات عليا;Public Universities
جامعة نجران دراسات عليا;Public Universities
جامعة الأميرة نورة بنت عبد الرحمن دراسات عليا;Public Universities
جامعة شقراء دراسات عليا;Public Universities
جامعة الدمام دراسات عليا;Public Universities
الجامعة السعودية الإلكترونية دراسات عليا;Public Universities
جامعة الأمير سلطان دراسات عليا;Private Universities and Colleges
الجامعة العربية المفتوحة دراسات عليا;Private Universities and Colleges
جامعة الأمير محمد بن فهد دراسات عليا;Private Universities and Colleges
جامعة الفيصل دراسات عليا;Private Universities and Colleges
جامعة اليمامة دراسات عليا;Private Universities and Colleges
جامعة عفت دراسات عليا;Private Universities and Colleges
جامعة دار  العلوم الأهلية دراسات عليا;Private Universities and Colleges
جامعة فهد بن سلطان دراسات عليا;Private Universities and Colleges
جامعة دار الحكمة دراسات عليا;Private Universities and Colleges
كلية ابن رشد للعلوم الإدارية دراسات عليا;Private Universities and Colleges
جامعة الأعمال والتكنولوجيا الأهلية دراسات عليا;Private Universities and Colleges
كليات الرياض لطب الأسنان والصيدلة دراسات عليا;Private Universities and Colleges
كلية الأمير سلطان للسياحة والإدارة بجدة دراسات عليا;Private Universities and Colleges
معهد الإدارة العامة دراسات عليا;Other Institutions
كلية الأمير سلطان العسكرية للعلوم الصحية بالظهران دراسات عليا;Other Institutions
الإجمالي الكلي;All Institution Types
جامعة الخرج ;Public Universities
الإجمالي العام ;All Institution Types
جامعة الامام محمد بن سعود الاسلامية;Public Universities
جامعة الرياض للبنات;Public Universities
الإجمالي;All Institution Types
الإجمالي الكلي;All Institution Types
جامعة أم القرى دبلوم متوسط;Public Universities
الجامعة الإسلامية دبلوم متوسط;Public Universities
جامعة الإمام محمد بن سعود الإسلامية دبلوم متوسط;Public Universities
جامعة الملك سعود دبلوم متوسط;Public Universities
جامعة الملك عبد العزيز دبلوم متوسط;Public Universities
جامعة الملك فهد للبترول والمعادن دبلوم متوسط;Public Universities
جامعة الملك فيصل دبلوم متوسط;Public Universities
جامعة الملك خالد دبلوم متوسط;Public Universities
جامعة القصيم دبلوم متوسط;Public Universities
جامعة طيبة دبلوم متوسط;Public Universities
جامعة جازان دبلوم متوسط;Public Universities
جامعة حائل دبلوم متوسط;Public Universities
جامعة الجوف دبلوم متوسط;Public Universities
جامعة تبوك دبلوم متوسط;Public Universities
جامعة الباحة دبلوم متوسط;Public Universities
جامعة نجران دبلوم متوسط;Public Universities
جامعة الأميرة نورة بنت عبد الرحمن دبلوم متوسط;Public Universities
جامعة الحدود الشمالية دبلوم متوسط;Public Universities
جامعة شقراء دبلوم متوسط;Public Universities
جامعة سلمان بن عبدالعزيز دبلوم متوسط;Public Universities
جامعة الدمام دبلوم متوسط;Public Universities
جامعة المجمعة دبلوم متوسط;Public Universities
إجمالي الجامعات الحكومية;Public Universities
كلية الجبيل الصناعية دبلوم متوسط;Other Institutions
قطاع ينبع التعليمي دبلوم متوسط;Other Institutions
معهد الإدارة العامة دبلوم المتوسط;Other Institutions
كلية الأمير سلطان العسكرية للعلوم الصحية بالظهران دبلوم متوسط;Other Institutions
معهد الجبيل التقني دبلوم متوسط;Other Institutions
المؤسسة العامة للتدريب التقني والمهني;Other Institutions
إجمالي مؤسسات التعليم العالي الأخرى;Other Institutions
إجمالي مؤسسات التعليم العالي في المملكة;All Institution Types
إجمالي الجامعات الحكومية;Public Universities
جامعة أم القرى بكالوريوس;Public Universities
الجامعة الإسلامية بكالوريوس;Public Universities
جامعة الإمام محمد بن سعود الإسلامية بكالوريوس;Public Universities
جامعة الملك سعود بكالوريوس;Public Universities
جامعة الملك عبد العزيز بكالوريوس;Public Universities
جامعة الملك فهد للبترول والمعادن بكالوريوس;Public Universities
جامعة الملك فيصل بكالوريوس;Public Universities
جامعة الملك خالد بكالوريوس;Public Universities
جامعة القصيم بكالوريوس;Public Universities
جامعة طيبة بكالوريوس;Public Universities
جامعة الطائف بكالوريوس;Public Universities
جامعة الملك سعود بن عبدالعزيز للعلوم الصحية بكالوريوس;Public Universities
جامعة جازان بكالوريوس;Public Universities
جامعة حائل بكالوريوس;Public Universities
جامعة الجوف بكالوريوس;Public Universities
جامعة تبوك بكالوريوس;Public Universities
جامعة الباحة بكالوريوس;Public Universities
جامعة نجران بكالوريوس;Public Universities
جامعة الأميرة نورة بنت عبد الرحمن بكالوريوس;Public Universities
جامعة الحدود الشمالية بكالوريوس;Public Universities
جامعة شقراء بكالوريوس;Public Universities
جامعة سلمان بن عبدالعزيز بكالوريوس;Public Universities
جامعة الدمام بكالوريوس;Public Universities
جامعة المجمعة بكالوريوس;Public Universities
الجامعة السعودية الإلكترونية بكالوريوس;Public Universities
إجمالي الجامعات والكليات الأهلية;Private Universities and Colleges
جامعة الأمير سلطان بكالوريوس;Private Universities and Colleges
الجامعة العربية المفتوحة بكالوريوس;Private Universities and Colleges
جامعة الأمير محمد بن فهد بكالوريوس;Private Universities and Colleges
جامعة الفيصل بكالوريوس;Private Universities and Colleges
جامعة اليمامة بكالوريوس;Private Universities and Colleges
جامعة عفت بكالوريوس;Private Universities and Colleges
جامعة دار العلوم الأهلية بكالوريوس;Private Universities and Colleges
جامعة فهد بن سلطان بكالوريوس;Private Universities and Colleges
كليات القصيم الأهلية بكالوريوس;Private Universities and Colleges
جامعة دار الحكمة بكالوريوس;Private Universities and Colleges
كلية ابن رشد للعلوم الإدارية بكالوريوس;Private Universities and Colleges
كلية الباحة الأهلية للعلوم بكالوريوس;Private Universities and Colleges
جامعة الأعمال والتكنولوجيا الأهلية بكالوريوس;Private Universities and Colleges
كلية الدكتور سليمان فقيه للتمريض والعلوم الطبية بكالوريوس;Private Universities and Colleges
الإجمالي الكلي;All Institution Types
كليات الرياض لطب الأسنان والصيدلة بكالوريوس;Private Universities and Colleges
كلية ابن سينا الأهلية للعلوم الطبية بكالوريوس;Private Universities and Colleges
كلية الأمير سلطان للسياحة والإدارة بجدة بكالوريوس;Private Universities and Colleges
كلية البترجي للعلوم الطبية والتكنولوجيا الأهلية بكالوريوس;Private Universities and Colleges
كلية سعد للتمريض والعلوم الصحية الأهلية بكالوريوس;Private Universities and Colleges
كلية الريادة للعلوم الصحية الأهلية بكالوريوس;Private Universities and Colleges
كلية المعرفة للعلوم والتقنية بكالوريوس;Private Universities and Colleges
كليات بريدة الأهلية بكالوريوس;Private Universities and Colleges
كلية محمد المانع الأهلية للعلوم الطبية بكالوريوس;Private Universities and Colleges
كلية الفارابي لطب الأسنان والتمريض بكالوريوس;Private Universities and Colleges
كليات الغد الدولية للعلوم الطبية التطبيقية بكالوريوس;Private Universities and Colleges
كليات سليمان الراجحي الأهلية بكالوريوس;Private Universities and Colleges
كلية العناية الطبية الأهلية بكالوريوس;Private Universities and Colleges
إجمالي مؤسسات التعليم العالي الأخرى;All Institution Types
كلية الجبيل الصناعية بكالوريوس;All Institution Types
الكلية الجامعية بالجبيل بكالوريوس;All Institution Types
قطاع ينبع التعليمي بكالوريوس;All Institution Types
كلية الأمير سلطان العسكرية للعلوم الصحية بالظهران بكالوريوس;All Institution Types
المؤسسة العامة للتدريب التقني والمهني بكالوريوس;All Institution Types
إجمالي مؤسسات التعليم العالي في المملكة;All Institution Types